id,name,date,tagline,description,minute,rating
1000742,The Help,2011,Change begins with a whisper.,"Aibileen Clark is a middle-aged African-American maid who has spent her life raising white children and has recently lost her only son; Minny Jackson is an African-American maid who has often offended her employers despite her family's struggles with money and her desperate need for jobs; and Eugenia ""Skeeter"" Phelan is a young white woman who has recently moved back home after graduating college to find out her childhood maid has mysteriously disappeared. These three stories intertwine to explain how life in Jackson, Mississippi revolves around ""the help""; yet they are always kept at a certain distance because of racial lines.",146,3.84
1000743,Burn After Reading,2008,Intelligence is relative.,"When a disc containing memoirs of a former CIA analyst falls into the hands of gym employees, Linda and Chad, they see a chance to make enough money for Linda to have life-changing cosmetic surgery. Predictably, events whirl out of control for the duo, and those in their orbit.",96,3.62
1000744,Incendies,2010,The search began at the opening of their mother's will.,"A mother's last wishes send twins Jeanne and Simon on a journey to Middle East in search of their tangled roots. Adapted from Wajdi Mouawad's acclaimed play, Incendies tells the powerful and moving tale of two young adults' voyage to the core of deep-rooted hatred, never-ending wars and enduring love.",131,4.41
1000745,The Tree of Life,2011,Nothing stands still.,"The impressionistic story of a Texas family in the 1950s. The film follows the life journey of the eldest son, Jack, through the innocence of childhood to his disillusioned adult years as he tries to reconcile a complicated relationship with his father. Jack finds himself a lost soul in the modern world, seeking answers to the origins and meaning of life while questioning the existence of faith.",139,3.86
1000746,After Hours,1985,"When it's after midnight in New York City, you don't have to look for love, laughter and trouble. They'll all find you!",An ordinary word processor has the worst night of his life after he agrees to visit a girl in Soho whom he met that evening at a coffee shop.,97,4.13
1000747,Pacific Rim,2013,"To Fight Monsters, We Created Monsters","When legions of monstrous creatures, known as Kaiju, started rising from the sea, a war began that would take millions of lives and consume humanity's resources for years on end. To combat the giant Kaiju, a special type of weapon was devised: massive robots, called Jaegers, which are controlled simultaneously by two pilots whose minds are locked in a neural bridge. But even the Jaegers are proving nearly defenseless in the face of the relentless Kaiju. On the verge of defeat, the forces defending mankind have no choice but to turn to two unlikely heroes—a washed-up former pilot (Charlie Hunnam) and an untested trainee (Rinko Kikuchi)—who are teamed to drive a legendary but seemingly obsolete Jaeger from the past. Together, they stand as mankind's last hope against the mounting apocalypse.",131,3.37
1000748,The Boy in the Striped Pyjamas,2008,"Lines may divide us, but hope will unite us.","When his family moves from their home in Berlin to a strange new house in Poland, young Bruno befriends Shmuel, a boy who lives on the other side of the fence where everyone seems to be wearing striped pajamas. Unaware of Shmuel's fate as a Jewish prisoner or the role his own Nazi father plays in his imprisonment, Bruno embarks on a dangerous journey inside the camp's walls.",94,3.62
1000749,Kung Fu Panda 2,2011,Prepare for the Year of Awesomeness!,"Po is now living his dream as The Dragon Warrior, protecting the Valley of Peace alongside his friends and fellow kung fu masters, The Furious Five - Tigress, Crane, Mantis, Viper and Monkey. But Po’s new life of awesomeness is threatened by the emergence of a formidable villain, who plans to use a secret, unstoppable weapon to conquer China and destroy kung fu. It is up to Po and The Furious Five to journey across China to face this threat and vanquish it. But how can Po stop a weapon that can stop kung fu? He must look to his past and uncover the secrets of his mysterious origins; only then will he be able to unlock the strength he needs to succeed.",91,3.69
1000750,Gremlins,1984,"Don't get him wet, keep him out of bright light, and never feed him after midnight.","When Billy Peltzer is given a strange but adorable pet named Gizmo for Christmas, he inadvertently breaks the three important rules of caring for a Mogwai, and unleashes a horde of mischievous gremlins on a small town.",106,3.63
1000751,Minority Report,2002,The system is perfect until it comes after you.,"John Anderton is a top 'Precrime' cop in the late-21st century, when technology can predict crimes before they're committed. But Anderton becomes the quarry when another investigator targets him for a murder charge.",145,3.75
1000752,Hamilton,2020,An American Musical,"An unforgettable cinematic stage performance, the filmed version of the original Broadway production of “Hamilton” combines the best elements of live theater, film and streaming to bring the cultural phenomenon to homes around the world for a thrilling, once-in-a-lifetime experience.",160,4.17
1000753,The 40 Year Old Virgin,2005,"The longer you wait, the harder it gets","Andy Stitzer has a pleasant life with a nice apartment and a job stamping invoices at an electronics store. But at age 40, there's one thing Andy hasn't done, and it's really bothering his sex-obsessed male co-workers: Andy is still a virgin. Determined to help Andy get laid, the guys make it their mission to de-virginize him. But it all seems hopeless until Andy meets small business owner Trish, a single mom.",116,3.31
1000754,50 First Dates,2004,Imagine having to win over the girl of your dreams... every friggin' day.,"Henry is a player skilled at seducing women. But when this veterinarian meets Lucy, a girl with a quirky problem when it comes to total recall, he realizes it's possible to fall in love all over again…and again, and again. That's because the delightful Lucy has no short-term memory, so Henry must woo her day after day until he finally sweeps her off her feet.",99,3.25
1000755,The House That Jack Built,2018,,"Failed architect, engineer and vicious murderer Jack narrates the details of some of his most elaborately orchestrated crimes, each of them a towering piece of art that defines his life's work as a serial killer for twelve years.",151,3.61
1000756,"Synecdoche, New York",2008,,"A theater director struggles with his work, and the women in his life, as he attempts to create a life-size replica of New York inside a warehouse as part of his new play.",124,4.18
1000757,Scream 4,2011,New Decade. New Rules.,"Sidney Prescott, now the author of a self-help book, returns home to Woodsboro on the last stop of her book tour. There she reconnects with Sheriff Dewey and Gale, who are now married, as well as her cousin Jill and her Aunt Kate. Unfortunately, Sidney's appearance also brings about the return of Ghostface, putting Sidney, Gale, and Dewey, along with Jill, her friends, and the whole town of Woodsboro in danger.",111,3.31
1000758,Evil Dead II,1987,The Sequel To The Ultimate Experience In Grueling Terror,"Ash Williams and his girlfriend Linda find a log cabin in the woods with a voice recording from an archeologist who had recorded himself reciting ancient chants from ""The Book of the Dead."" As they play the recording an evil power is unleashed taking over Linda's body.",84,4.02
1000759,Jurassic World: Fallen Kingdom,2018,The park is gone,"Three years after the demise of Jurassic World, a volcanic eruption threatens the remaining dinosaurs on the isla Nublar, so Claire Dearing, the former park manager, recruits Owen Grady to help prevent the extinction of the dinosaurs once again.",129,2.58
1000760,The Fast and the Furious,2001,Live life 1/4 mile at a time.,"Domenic Toretto is a Los Angeles street racer suspected of masterminding a series of big-rig hijackings. When undercover cop Brian O'Conner infiltrates Toretto's iconoclastic crew, he falls for Toretto's sister and must choose a side: the gang or the LAPD.",106,3.33
1000761,The Marvels,2023,Higher. Further. Faster. Together.,"Carol Danvers, aka Captain Marvel, has reclaimed her identity from the tyrannical Kree and taken revenge on the Supreme Intelligence. But unintended consequences see Carol shouldering the burden of a destabilized universe. When her duties send her to an anomalous wormhole linked to a Kree revolutionary, her powers become entangled with that of Jersey City super-fan Kamala Khan, aka Ms. Marvel, and Carol’s estranged niece, now S.A.B.E.R. astronaut Captain Monica Rambeau. Together, this unlikely trio must team up and learn to work in concert to save the universe.",105,2.65
1000762,We're the Millers,2013,-If anyone asks.,A veteran pot dealer creates a fake family as part of his plan to move a huge shipment of weed into the U.S. from Mexico.,110,3.24
1000763,The Fault in Our Stars,2014,,"Despite the tumor-shrinking medical miracle that has bought her a few years, Hazel has never been anything but terminal, her final chapter inscribed upon diagnosis. But when a patient named Augustus Waters suddenly appears at Cancer Kid Support Group, Hazel's story is about to be completely rewritten.",126,3.1
1000764,The Goonies,1985,"The pirates map, The villainous crooks, The underground caverns, The booby traps, The skeletons, The monster, The lost treasure, and the magic that is… THE GOONIES.","A young teenager named Mikey Walsh finds an old treasure map in his father's attic. Hoping to save their homes from demolition, Mikey and his friends Data Wang, Chunk Cohen, and Mouth Devereaux run off on a big quest to find the secret stash of Pirate One-Eyed Willie.",114,3.78
1000765,She's the Man,2006,"If you wanna chase your dream, sometimes you gotta break the rules.","Viola Johnson is in a real jam. Complications threaten her scheme to pose as her twin brother, Sebastian, and take his place at a new boarding school. She falls in love with her handsome roommate, Duke, who loves beautiful Olivia, who has fallen for Sebastian! As if that were not enough, Viola's twin returns from London ahead of schedule but has no idea that his sister has already replaced him on campus.",105,3.34
1000766,Divergent,2014,What makes you different makes you dangerous.,"In a world divided into factions based on personality types, Tris learns that she's been classified as Divergent and won't fit in. When she discovers a plot to destroy Divergents, Tris and the mysterious Four must find out what makes Divergents dangerous before it's too late.",139,2.84
1000767,Raya and the Last Dragon,2021,A quest to save her world.,"Long ago, in the fantasy world of Kumandra, humans and dragons lived together in harmony. But when an evil force threatened the land, the dragons sacrificed themselves to save humanity. Now, 500 years later, that same evil has returned and it’s up to a lone warrior, Raya, to track down the legendary last dragon to restore the fractured land and its divided people.",107,3.28
1000768,Jurassic World Dominion,2022,The epic conclusion of the Jurassic era.,"Four years after Isla Nublar was destroyed, dinosaurs now live—and hunt—alongside humans all over the world. This fragile balance will reshape the future and determine, once and for all, whether human beings are to remain the apex predators on a planet they now share with history’s most fearsome creatures.",147,2.2
1000769,Kong: Skull Island,2017,All hail the king,"Explore the mysterious and dangerous home of the king of the apes as a team of explorers ventures deep inside the treacherous, primordial island.",118,3.07
1000770,Nimona,2023,A new hero takes shape.,"A knight framed for a tragic crime teams with a scrappy, shape-shifting teen to prove his innocence.",99,3.94
1000771,The Craft,1996,Welcome to the witching hour.,"A Catholic school newcomer falls in with a clique of teen witches who wield their powers against all who dare to cross them -- be they teachers, rivals or meddlesome parents.",101,3.52
1000772,Sunset Boulevard,1950,A Hollywood Story,A hack screenwriter writes a screenplay for a former silent film star who has faded into Hollywood obscurity.,110,4.44
1000773,Les Misérables,2012,Fight. Dream. Hope. Love.,"An adaptation of the successful stage musical based on Victor Hugo's classic novel set in 19th-century France, in which a paroled prisoner named Jean Valjean seeks redemption.",158,3.58
1000774,Prometheus,2012,The Search for Our Beginning Could Lead to Our End.,"A team of explorers discover a clue to the origins of mankind on Earth, leading them on a journey to the darkest corners of the universe. There, they must fight a terrifying battle to save the future of the human race.",124,3.24
1000775,Death Proof,2007,A crash course in revenge,"Austin's hottest DJ, Jungle Julia, sets out into the night to unwind with her two friends Shanna and Arlene. Covertly tracking their moves is Stuntman Mike, a scarred rebel leering from behind the wheel of his muscle car, revving just feet away.",113,3.56
1000776,Murder on the Orient Express,2017,Everyone is a suspect,Genius Belgian detective Hercule Poirot investigates the murder of an American tycoon aboard the Orient Express train.,114,3.06
1000777,Glass,2019,You Cannot Contain What You Are,"In a series of escalating encounters, former security guard David Dunn uses his supernatural abilities to track Kevin Wendell Crumb, a disturbed man who has twenty-four personalities. Meanwhile, the shadowy presence of Elijah Price emerges as an orchestrator who holds secrets critical to both men.",129,2.9
1000778,Klaus,2019,Welcome to the jingle,"When Jesper distinguishes himself as the Postal Academy's worst student, he is sent to Smeerensburg, a small village located on an icy island above the Arctic Circle, where grumpy inhabitants barely exchange words, let alone letters. Jesper is about to give up and abandon his duty as a postman when he meets local teacher Alva and Klaus, a mysterious carpenter who lives alone in a cabin full of handmade toys.",96,4.12
1000779,X-Men: Apocalypse,2016,Only the strong will survive,"After the re-emergence of the world's first mutant, world-destroyer Apocalypse, the X-Men must unite to defeat his extinction level plan.",144,2.58
1000780,The Twilight Saga: Breaking Dawn – Part 2,2012,The epic finale that will live forever.,"After the birth of Renesmee, the Cullens gather other vampire clans in order to protect the child from a false allegation that puts the family in front of the Volturi.",115,2.77
1000781,Pokémon Detective Pikachu,2019,Partner Up!,"In a world where people collect pocket-size monsters (Pokémon) to do battle, a boy comes across an intelligent monster who seeks to be a detective.",105,3.04
1000782,Immaculate,2024,Not every intervention is divine.,"An American nun embarks on a new journey when she joins a remote convent in the Italian countryside. However, her warm welcome quickly turns into a living nightmare when she discovers her new home harbours a sinister secret and unspeakable horrors.",89,2.97
1000783,Videodrome,1983,First it controls your mind. Then it destroys your body.,"As the president of a trashy TV channel, Max Renn is desperate for new programming to attract viewers. When he happens upon ""Videodrome,"" a TV show dedicated to gratuitous torture and punishment, Max sees a potential hit and broadcasts the show on his channel. However, after his girlfriend auditions for the show and never returns, Max investigates the truth behind Videodrome and discovers that the graphic violence may not be as fake as he thought.",88,3.88
1000784,The Place Beyond the Pines,2012,If you ride like lightning you're gonna crash like thunder,"A motorcycle stunt rider considers committing a crime in order to provide for his wife and child, an act that puts him on a collision course with a cop-turned-politician.",140,3.78
1000785,Maleficent,2014,Don't believe the fairy tale.,"A beautiful, pure-hearted young woman, Maleficent has an idyllic life growing up in a peaceable forest kingdom, until one day when an invading army threatens the harmony of the land.  Maleficent rises to be the land's fiercest protector, but she ultimately suffers a ruthless betrayal – an act that begins to turn her heart into stone. Bent on revenge, Maleficent faces an epic battle with the invading King's successor and, as a result, places a curse upon his newborn infant Aurora. As the child grows, Maleficent realizes that Aurora holds the key to peace in the kingdom – and to Maleficent's true happiness as well.",97,3.17
1000786,Scary Movie,2000,No mercy. No shame. No sequel.,"Following on the heels of popular teen-scream horror movies, with uproarious comedy and biting satire. Marlon and Shawn Wayans, Shannon Elizabeth and Carmen Electra pitch in to skewer some of Hollywood's biggest blockbusters, including Scream, I Know What You Did Last Summer, The Matrix, American Pie and The Blair Witch Project.",88,3.06
1000787,High School Musical,2006,This School Rocks Like No Other!,"Troy, the popular captain of the basketball team, and Gabriella, the brainy and beautiful member of the academic club, break all the rules of East High society when they secretly audition for the leads in the school's musical. As they reach for the stars and follow their dreams, everyone learns about acceptance, teamwork, and being yourself.",98,3.16
1000788,The Fifth Element,1997,There is no future without it.,"In 2257, a taxi driver is unintentionally given the task of saving a young girl who is part of the key that will ensure the survival of humanity.",126,3.74
1000789,Spectre,2015,A Plan No One Escapes,"A cryptic message from Bond’s past sends him on a trail to uncover a sinister organization. While M battles political forces to keep the secret service alive, Bond peels back the layers of deceit to reveal the terrible truth behind SPECTRE.",148,3.15
1000790,"O Brother, Where Art Thou?",2000,They have a plan...but not a clue.,"In the deep south during the 1930s, three escaped convicts search for hidden treasure while a relentless lawman pursues them. On their journey they come across many comical characters and incredible situations. Based upon Homer's 'Odyssey'.",107,3.94
1000791,Captain Fantastic,2016,He Prepared Them for Everything Except the Outside World.,A father living in the forests of the Pacific Northwest with his six young kids tries to assimilate back into society.,118,3.92
1000792,Thirteen,2003,It's happening so fast.,"Tracy is a normal 13-year-old trying to make it in school. After befriending the most popular girl at school, Evie, Tracy's world is turned upside down when Evie introduces her to a world of sex, drugs and cash. But it isn't long before Tracy's new world and attitude finally takes a toll on her, her family, and old friends.",100,3.48
1000793,Transformers,2007,Their war. Our world.,"Young teenager, Sam Witwicky becomes involved in the ancient struggle between two extraterrestrial factions of transforming robots – the heroic Autobots and the evil Decepticons. Sam holds the clue to unimaginable power and the Decepticons will stop at nothing to retrieve it.",144,3.12
1000794,Fantastic Beasts: The Crimes of Grindelwald,2018,Fate of One. Future of All.,"Gellert Grindelwald has escaped imprisonment and has begun gathering followers to his cause—elevating wizards above all non-magical beings. The only one capable of putting a stop to him is the wizard he once called his closest friend, Albus Dumbledore. However, Dumbledore will need to seek help from the wizard who had thwarted Grindelwald once before, his former student Newt Scamander, who agrees to help, unaware of the dangers that lie ahead. Lines are drawn as love and loyalty are tested, even among the truest friends and family, in an increasingly divided wizarding world.",134,2.56
1000795,Shoplifters,2018,Sometimes you choose your family.,"After one of their shoplifting sessions, Osamu and his son come across a little girl in the freezing cold. At first reluctant to shelter the girl, Osamu’s wife agrees to take care of her after learning of the hardships she faces. Although the family is poor, barely making enough money to survive through petty crime, they seem to live happily together until an unforeseen incident reveals hidden secrets, testing the bonds that unite them.",120,4.3
1000796,Madame Web,2024,Her web connects them all.,"Forced to confront revelations about her past, paramedic Cassandra Webb forges a relationship with three young women destined for powerful futures...if they can all survive a deadly present.",116,1.49
1000797,The Gray Man,2022,"We're gonna train you to kill bad guys. And since you've already killed one, it shouldn't be too difficult.","When a shadowy CIA agent uncovers damning agency secrets, he's hunted across the globe by a sociopathic rogue operative who's put a bounty on his head.",122,2.73
1000798,The Terminal,2004,Life is waiting.,"Viktor Navorski is a man without a country; his plane took off just as a coup d'etat exploded in his homeland, leaving it in shambles, and now he's stranded at Kennedy Airport, where he's holding a passport that nobody recognizes. While quarantined in the transit lounge until authorities can figure out what to do with him, Viktor simply goes on living – and courts romance with a beautiful flight attendant.",128,3.59
1000799,The Butterfly Effect,2004,"Such minor changes, such huge consequences.","A young man struggles to access sublimated childhood memories. He finds a technique that allows him to travel back into the past, to occupy his childhood body and change history. However, he soon finds that every change he makes has unexpected consequences.",120,3.46
1000800,The Lion King,2019,The King has Returned.,"Simba idolizes his father, King Mufasa, and takes to heart his own royal destiny. But not everyone in the kingdom celebrates the new cub's arrival. Scar, Mufasa's brother—and former heir to the throne—has plans of his own. The battle for Pride Rock is ravaged with betrayal, tragedy and drama, ultimately resulting in Simba's exile. With help from a curious pair of newfound friends, Simba will have to figure out how to grow up and take back what is rightfully his.",118,2.77
1000801,District 9,2009,You are not welcome here.,"Thirty years ago, aliens arrive on Earth. Not to conquer or give aid, but to find refuge from their dying planet. Separated from humans in a South African area called District 9, the aliens are managed by Multi-National United, which is unconcerned with the aliens' welfare but will do anything to master their advanced technology. When a company field agent contracts a mysterious virus that begins to alter his DNA, there is only one place he can hide: District 9.",112,3.8
1000802,Indiana Jones and the Kingdom of the Crystal Skull,2008,The adventure continues . . .,"Set during the Cold War, the Soviets – led by sword-wielding Irina Spalko – are in search of a crystal skull which has supernatural powers related to a mystical Lost City of Gold. After being captured and then escaping from them, Indy is coerced to head to Peru at the behest of a young man whose friend – and Indy's colleague – Professor Oxley has been captured for his knowledge of the skull's whereabouts.",122,2.69
1000803,The Twilight Saga: Breaking Dawn – Part 1,2011,Forever is just the beginning,The new found married bliss of Bella Swan and vampire Edward Cullen is cut short when a series of betrayals and misfortunes threatens to destroy their world.,117,2.55
1000804,Men,2022,What haunts you will find you.,"In the aftermath of a personal tragedy, Harper retreats alone to the beautiful English countryside, hoping to find a place to heal. But someone or something from the surrounding woods appears to be stalking her. What begins as simmering dread becomes a fully-formed nightmare, inhabited by her darkest memories and fears.",100,2.82
1000805,I Care a Lot,2020,,A court-appointed legal guardian defrauds her older clients and traps them under her care. But her latest mark comes with some unexpected baggage.,119,3.11
1000806,Black Adam,2022,The world needed a hero. It got Black Adam.,"Nearly 5,000 years after he was bestowed with the almighty powers of the Egyptian gods—and imprisoned just as quickly—Black Adam is freed from his earthly tomb, ready to unleash his unique form of justice on the modern world.",125,2.31
1000807,Predator,1987,Soon the hunt will begin.,"Dutch and his group of commandos are hired by the CIA to rescue downed airmen from guerillas in a Central American jungle. The mission goes well but as they return they find that something is hunting them. Nearly invisible, it blends in with the forest, taking trophies from the bodies of its victims as it goes along. Occasionally seeing through its eyes, the audience sees it is an intelligent alien hunter, hunting them for sport, killing them off one at a time.",107,3.79
1000808,Sherlock Holmes,2009,Nothing escapes him.,Eccentric consulting detective Sherlock Holmes and Doctor John Watson battle to bring down a new nemesis and unravel a deadly plot that could destroy England.,129,3.43
1000809,The King's Speech,2010,Find your voice.,"The King's Speech tells the story of the man who became King George VI, the father of Queen Elizabeth II. After his brother abdicates, George ('Bertie') reluctantly assumes the throne. Plagued by a dreaded stutter and considered unfit to be king, Bertie engages the help of an unorthodox speech therapist named Lionel Logue. Through a set of unexpected techniques, and as a result of an unlikely friendship, Bertie is able to find his voice and boldly lead the country into war.",118,3.78
