id,name,date,tagline,description,minute,rating
1000219,Society of the Snow,2023,Based on a remarkable true story.,"On October 13, 1972, Uruguayan Air Force Flight 571, chartered to take a rugby team to Chile, crashes into a glacier in the heart of the Andes.",144,4.13
1000220,Last Night in Soho,2021,"When the past lets you in, the truth will come out.","A young girl, passionate about fashion design, is mysteriously able to enter the 1960s where she encounters her idol, a dazzling wannabe singer. But 1960s London is not what it seems, and time seems to be falling apart with shady consequences.",116,3.41
1000221,Black Widow,2021,She's Done Running From Her Past.,"Natasha Romanoff, also known as Black Widow, confronts the darker parts of her ledger when a dangerous conspiracy with ties to her past arises. Pursued by a force that will stop at nothing to bring her down, Natasha must deal with her history as a spy and the broken relationships left in her wake long before she became an Avenger.",134,2.93
1000222,No Hard Feelings,2023,Not a love story.,"On the brink of losing her childhood home, Maddie discovers an intriguing job listing: wealthy helicopter parents looking for someone to “date” their introverted 19-year-old son, Percy, before he leaves for college. To her surprise, Maddie soon discovers the awkward Percy is no sure thing.",104,3.05
1000223,Star Wars: Episode I – The Phantom Menace,1999,Every generation has a legend. Every journey has a first step. Every saga has a beginning.,"Anakin Skywalker, a young slave strong with the Force, is discovered on Tatooine. Meanwhile, the evil Sith have returned, enacting their plot for revenge against the Jedi.",136,2.91
1000224,Mulholland Drive,2001,An actress longing to be a star. A woman searching for herself. Both worlds will collide… on Mulholland Drive.,"Blonde Betty Elms has only just arrived in Hollywood to become a movie star when she meets an enigmatic brunette with amnesia. Meanwhile, as the two set off to solve the second woman's identity, filmmaker Adam Kesher runs into ominous trouble while casting his latest project.",147,4.24
1000225,The Big Lebowski,1998,It’s good knowin’ he’s out there. The Dude. Takin’ ‘er easy for all us sinners.,"Jeffrey ""The Dude"" Lebowski, a Los Angeles slacker who only wants to bowl and drink White Russians, is mistaken for another Jeffrey Lebowski, a wheelchair-bound millionaire, and finds himself dragged into a strange series of events involving nihilists, adult film producers, ferrets, errant toes, and large sums of money.",117,4.13
1000226,Scarface,1983,The world is yours...,"After getting a green card in exchange for assassinating a Cuban government official, Tony Montana stakes a claim on the drug trade in Miami. Viciously murdering anyone who stands in his way, Tony eventually becomes the biggest drug lord in the state, controlling nearly all the cocaine that comes through Miami. But increased pressure from the police, wars with Colombian drug cartels and his own drug-fueled paranoia serve to fuel the flames of his eventual downfall.",169,4.11
1000227,Léon: The Professional,1994,"If you want a job done well, hire a professional.","Léon, the top hit man in New York, has earned a rep as an effective ""cleaner"". But when his next-door neighbors are wiped out by a loose-cannon DEA agent, he becomes the unwilling custodian of 12-year-old Mathilda. Before long, Mathilda's thoughts turn to revenge, and she considers following in Léon's footsteps.",111,4.03
1000228,"I, Tonya",2017,Fitting in is overrated,"Competitive ice skater Tonya Harding rises amongst the ranks at the U.S. Figure Skating Championships, but her future in the sport is thrown into doubt when her ex-husband intervenes.",120,3.85
1000229,The Godfather: Part II,1974,"I don't feel I have to wipe everybody out, Tom. Just my enemies.","In the continuing saga of the Corleone crime family, a young Vito Corleone grows up in Sicily and in 1910s New York. In the 1950s, Michael Corleone attempts to expand the family business into Las Vegas, Hollywood and Cuba.",202,4.59
1000230,Harry Potter and the Half-Blood Prince,2009,Dark Secrets Revealed,"As Harry begins his sixth year at Hogwarts, he discovers an old book marked as 'Property of the Half-Blood Prince', and begins to learn more about Lord Voldemort's dark past.",153,3.67
1000231,Shang-Chi and the Legend of the Ten Rings,2021,You can't outrun your destiny.,Shang-Chi must confront the past he thought he left behind when he is drawn into the web of the mysterious Ten Rings organization.,132,3.45
1000232,Captain Marvel,2019,Higher. Further. Faster.,"The story follows Carol Danvers as she becomes one of the universe’s most powerful heroes when Earth is caught in the middle of a galactic war between two alien races. Set in the 1990s, Captain Marvel is an all-new adventure from a previously unseen period in the history of the Marvel Cinematic Universe.",124,2.7
1000233,Harry Potter and the Deathly Hallows: Part 1,2010,Nowhere is safe.,"Harry, Ron and Hermione walk away from their last year at Hogwarts to find and destroy the remaining Horcruxes, putting an end to Voldemort's bid for immortality. But with Harry's beloved Dumbledore dead and Voldemort's unscrupulous Death Eaters on the loose, the world is more dangerous than ever.",146,3.69
1000234,Moonrise Kingdom,2012,A tormenting and surprising story of children and adults during the stormy days of the summer of 1965.,"Set on an island off the coast of New England in the summer of 1965, Moonrise Kingdom tells the story of two twelve-year-olds who fall in love, make a secret pact, and run away together into the wilderness. As various authorities try to hunt them down, a violent storm is brewing off-shore – and the peaceful island community is turned upside down in more ways than anyone can handle.",94,4.02
1000235,The Iron Claw,2023,Sons. Brothers. Champions.,"The true story of the inseparable Von Erich brothers, who made history in the intensely competitive world of professional wrestling in the early 1980s. Through tragedy and triumph, under the shadow of their domineering father and coach, the brothers seek larger-than-life immortality on the biggest stage in sports.",132,4.11
1000236,Rogue One: A Star Wars Story,2016,A Rebellion Built on Hope,A rogue band of resistance fighters unite for a mission to steal the Death Star plans and bring a new hope to the galaxy.,133,3.72
1000237,Ferris Bueller's Day Off,1986,One man's struggle to take it easy.,"After high school slacker Ferris Bueller successfully fakes an illness in order to skip school for the day, he goes on a series of adventures throughout Chicago with his girlfriend Sloane and best friend Cameron, all the while trying to outwit his wily school principal and fed-up sister.",103,3.93
1000238,The Notebook,2004,Behind every great love is a great story.,"An epic love story centered around an older man who reads aloud to a woman with Alzheimer's. From a faded notebook, the old man's words bring to life the story about a couple who is separated by World War II, and is then passionately reunited, seven years later, after they have taken different paths.",123,3.7
1000239,12 Angry Men,1957,Life is in their hands. Death is on their minds.,"The defense and the prosecution have rested and the jury is filing into the jury room to decide if a young Spanish-American is guilty or innocent of murdering his father. What begins as an open and shut case soon becomes a mini-drama of each of the jurors' prejudices and preconceptions about the trial, the accused, and each other.",97,4.62
1000240,The Nice Guys,2016,Private dicks,A private eye investigates the apparent suicide of a fading porn star in 1970s Los Angeles and uncovers a conspiracy.,116,3.83
1000241,Kill Bill: Vol. 2,2004,The bride is back for the final cut.,"The Bride unwaveringly continues on her roaring rampage of revenge against the band of assassins who had tried to kill her and her unborn child. She visits each of her former associates one-by-one, checking off the victims on her Death List Five until there's nothing left to do … but kill Bill.",136,4.06
1000242,The Thing,1982,Man is The Warmest Place to Hide.,"In remote Antarctica, a group of American research scientists are disturbed at their base camp by a helicopter shooting at a sled dog. When they take in the dog, it brutally attacks both human beings and canines in the camp and they discover that the beast can assume the shape of its victims. A resourceful helicopter pilot and the camp doctor lead the camp crew in a desperate, gory battle against the vicious creature before it picks them all off, one by one.",109,4.35
1000243,Pirates of the Caribbean: The Curse of the Black Pearl,2003,Prepare to be blown out of the water.,"Jack Sparrow, a freewheeling 18th-century pirate, quarrels with a rival pirate bent on pillaging Port Royal. When the governor's daughter is kidnapped, Sparrow decides to help the girl's love save her.",143,3.92
1000244,Edward Scissorhands,1990,His scars run deep.,A small suburban town receives a visit from a castaway unfinished science experiment named Edward.,105,3.86
1000245,The Amazing Spider-Man,2012,The untold story begins.,"Peter Parker is an outcast high schooler abandoned by his parents as a boy, leaving him to be raised by his Uncle Ben and Aunt May. Like most teenagers, Peter is trying to figure out who he is and how he got to be the person he is today. As Peter discovers a mysterious briefcase that belonged to his father, he begins a quest to understand his parents' disappearance – leading him directly to Oscorp and the lab of Dr. Curt Connors, his father's former partner. As Spider-Man is set on a collision course with Connors' alter ego, The Lizard, Peter will make life-altering choices to use his powers and shape his destiny to become a hero.",136,3.3
1000246,Trainspotting,1996,Choose life.,"Mark Renton, deeply immersed in the Edinburgh drug scene, tries to clean up and get out, despite the allure of the drugs and influence of friends.",94,4.2
1000247,Logan,2017,His time has come,"In the near future, a weary Logan cares for an ailing Professor X in a hideout on the Mexican border. But Logan's attempts to hide from the world and his legacy are upended when a young mutant arrives, pursued by dark forces.",137,4.1
1000248,Saving Private Ryan,1998,The mission is a man.,"As U.S. troops storm the beaches of Normandy, three brothers lie dead on the battlefield, with a fourth trapped behind enemy lines. Ranger captain John Miller and seven men are tasked with penetrating German-held territory and bringing the boy home.",169,4.24
1000249,Ant-Man,2015,Heroes don't get any bigger.,"Armed with the astonishing ability to shrink in scale but increase in strength, master thief Scott Lang must embrace his inner-hero and help his mentor, Doctor Hank Pym, protect the secret behind his spectacular Ant-Man suit from a new generation of towering threats. Against seemingly insurmountable obstacles, Pym and Lang must plan and pull off a heist that will save the world.",117,3.23
1000250,Elvis,2022,The man. The legend. The King of Rock & Roll.,"The life story of Elvis Presley as seen through the complicated relationship with his enigmatic manager, Colonel Tom Parker.",159,3.35
1000251,The Revenant,2015,"(n. One who has returned, as if from the dead.)","In the 1820s, a frontiersman, Hugh Glass, sets out on a path of vengeance against those who left him for dead after a bear mauling.",157,3.87
1000252,Bones and All,2022,,"Abandoned by her father, a young woman embarks on a thousand-mile odyssey through the backroads of America where she meets a disenfranchised drifter. But despite their best efforts, all roads lead back to their terrifying pasts and to a final stand that will determine whether their love can survive their otherness.",131,3.65
1000253,BlacKkKlansman,2018,Infiltrate hate.,"Colorado Springs, late 1970s. Ron Stallworth, an African American police officer, and Flip Zimmerman, his Jewish colleague, run an undercover operation to infiltrate the Ku Klux Klan.",136,3.94
1000254,Captain America: The First Avenger,2011,When patriots become heroes,"During World War II, Steve Rogers is a sickly man from Brooklyn who's transformed into super-soldier Captain America to aid in the war effort. Rogers must stop the Red Skull – Adolf Hitler's ruthless head of weaponry, and the leader of an organization that intends to use a mysterious device of untold powers for world domination.",124,3.26
1000255,American Beauty,1999,Look closer.,"Lester Burnham, a depressed suburban father in a mid-life crisis, decides to turn his hectic life around after developing an infatuation with his daughter's attractive friend.",122,3.96
1000256,Black Panther: Wakanda Forever,2022,Forever.,"Queen Ramonda, Shuri, M’Baku, Okoye and the Dora Milaje fight to protect their nation from intervening world powers in the wake of King T’Challa’s death. As the Wakandans strive to embrace their next chapter, the heroes must band together with the help of War Dog Nakia and Everett Ross and forge a new path for the kingdom of Wakanda.",162,3.36
1000257,The Favourite,2018,,"England, early 18th century. The close relationship between Queen Anne and Sarah Churchill is threatened by the arrival of Sarah's cousin, Abigail Hill, resulting in a bitter rivalry between the two cousins to be the Queen's favourite.",120,4.03
1000258,The Shape of Water,2017,A Fairy Tale for Troubled Times,"An other-worldly story, set against the backdrop of Cold War era America circa 1962, where a mute janitor working at a lab falls in love with an amphibious man being held captive there and devises a plan to help him escape.",123,3.67
1000259,The Great Gatsby,2013,Reserving judgments is a matter of infinite hope... I come to the admission that it has a limit.,"An adaptation of F. Scott Fitzgerald's Long Island-set novel, where Midwesterner Nick Carraway is lured into the lavish world of his neighbor, Jay Gatsby. Soon enough, however, Carraway will see through the cracks of Gatsby's nouveau riche existence, where obsession, madness, and tragedy await.",143,3.38
1000260,Your Name.,2016,,"High schoolers Mitsuha and Taki are complete strangers living separate lives. But one night, they suddenly switch places. Mitsuha wakes up in Taki’s body, and he in hers. This bizarre occurrence continues to happen randomly, and the two must adjust their lives around each other.",106,4.21
1000261,Eyes Wide Shut,1999,Cruise. Kidman. Kubrick.,"After Dr. Bill Harford's wife, Alice, admits to having sexual fantasies about a man she met, Bill becomes obsessed with having a sexual encounter. He discovers an underground sexual group and attends one of their meetings -- and quickly discovers that he is in over his head.",159,4.0
1000262,Apocalypse Now,1979,This is the end...,"At the height of the Vietnam war, Captain Benjamin Willard is sent on a dangerous mission that, officially, ""does not exist, nor will it ever exist."" His goal is to locate - and eliminate - a mysterious Green Beret Colonel named Walter Kurtz, who has been leading his personal army on illegal guerrilla missions into enemy territory.",147,4.44
1000263,About Time,2013,What if every moment in life came with a second chance?,"The night after another unsatisfactory New Year party, Tim's father tells his son that the men in his family have always had the ability to travel through time. Tim can't change history, but he can change what happens and has happened in his own life – so he decides to make his world a better place... by getting a girlfriend. Sadly, that turns out not to be as easy as he thinks.",123,4.01
1000264,Luca,2021,Prepare for an unforgettable trip.,"Two young boys experience an unforgettable Italian summer filled with gelato, pasta and endless scooter rides. But all the fun is threatened by a deeply-held secret: they are sea monsters from another world just below the water’s surface.",95,3.74
1000265,Five Nights at Freddy's,2023,Can you survive five nights?,"Recently fired and desperate for work, a troubled young man named Mike agrees to take a position as a night security guard at an abandoned theme restaurant: Freddy Fazbear's Pizzeria. But he soon discovers that nothing at Freddy's is what it seems.",110,2.56
1000266,Deadpool 2,2018,Prepare for the Second Coming.,Wisecracking mercenary Deadpool battles the evil and powerful Cable and other bad guys to save a boy's life.,120,3.49
1000267,Jennifer's Body,2009,She's evil... and not just high school evil,A newly possessed cheerleader turns into a killer who specializes in offing her male classmates. Can her best friend put an end to the horror?,107,3.42
1000268,The Worst Person in the World,2021,,"Chronicles four years in the life of Julie, a young woman who navigates the troubled waters of her love life and struggles to find her career path, leading her to take a realistic look at who she really is.",128,4.12
1000269,Toy Story 3,2010,No toy gets left behind.,"Woody, Buzz, and the rest of Andy's toys haven't been played with in years. With Andy about to go to college, the gang find themselves accidentally left at a nefarious day care center. The toys must band together to escape and return home to Andy.",103,3.99
1000270,The Florida Project,2017,Welcome to a magical kingdom,"The story of a precocious six year-old and her ragtag group of friends whose summer break is filled with childhood wonder, possibility and a sense of adventure while the adults around them struggle with hard times.",112,4.1
1000271,"Girl, Interrupted",1999,"The crazy thing is, you're not crazy.","Set in the changing world of the late 1960s, Susanna Kaysen's prescribed ""short rest"" from a psychiatrist she had met only once becomes a strange, unknown journey into Alice's Wonderland, where she struggles with the thin line between normal and crazy. Susanna soon realizes how hard it is to get out once she has been committed, and she ultimately has to choose between the world of people who belong inside or the difficult world of reality outside.",127,3.89
1000272,The Hateful Eight,2015,No one comes up here without a damn good reason.,Bounty hunters seek shelter from a raging blizzard and get caught up in a plot of betrayal and deception.,188,3.95
1000273,The Virgin Suicides,1999,"Beautiful, mysterious, haunting, invariably fatal. Just like life.","A group of male friends become obsessed with five mysterious sisters who are sheltered by their strict, religious parents.",97,3.83
1000274,Zootopia,2016,Welcome to the urban jungle.,"Determined to prove herself, Officer Judy Hopps, the first bunny on Zootopia's police force, jumps at the chance to crack her first case - even if it means partnering with scam-artist fox Nick Wilde to solve the mystery.",109,3.7
1000275,In the Mood for Love,2000,"Feel the heat, keep the feeling burning, let the sensation explode.","Taking place in Hong Kong of 1962, a melancholy story about the love between a woman and a man who live in the same building and one day find out that their husband and wife had an affair with each other.",98,4.4
1000276,Turning Red,2022,Growing up is a beast.,"Thirteen-year-old Mei is experiencing the awkwardness of being a teenager with a twist – when she gets too excited, she transforms into a giant red panda.",100,3.52
1000277,Booksmart,2019,Getting straight A's. Giving zero F's.,"Two academic teenage superstars realize, on the eve of their high school graduation, that they should have worked less and played more. Determined to never fall short of their peers, the girls set out on a mission to cram four years of fun into one night.",102,3.75
1000278,Raiders of the Lost Ark,1981,Indiana Jones - the new hero from the creators of JAWS and STAR WARS.,"When Dr. Indiana Jones – the tweed-suited professor who just happens to be a celebrated archaeologist – is hired by the government to locate the legendary Ark of the Covenant, he finds himself up against the entire Nazi regime.",115,4.16
1000279,Star Wars: The Rise of Skywalker,2019,Every generation has a legend,"The surviving Resistance faces the First Order once again as the journey of Rey, Finn and Poe Dameron continues. With the power and knowledge of generations behind them, the final battle begins.",142,2.36
1000280,Isle of Dogs,2018,Welcome to the Isle of Dogs.,"In the future, an outbreak of canine flu leads the mayor of a Japanese city to banish all dogs to an island that's a garbage dump. The outcasts must soon embark on an epic journey when a 12-year-old boy arrives on the island to find his beloved pet.",101,3.97
1000281,Triangle of Sadness,2022,,"Models Carl and Yaya are invited for a luxury cruise with a rogues' gallery of super-rich passengers. At first, all appears Instagrammable, but the cruise ends catastrophically and the group find themselves marooned on a desert island.",147,3.69
1000282,Star Wars: Episode II – Attack of the Clones,2002,A Jedi Shall Not Know Anger. Nor Hatred. Nor Love.,"Following an assassination attempt on Senator Padmé Amidala, Jedi Knights Anakin Skywalker and Obi-Wan Kenobi investigate a mysterious plot that could change the galaxy forever.",142,2.83
1000283,Beautiful Boy,2018,,"After he and his first wife separate, journalist David Sheff struggles to help their teenage son, who goes from experimenting with drugs to becoming devastatingly addicted to methamphetamine.",119,3.9
1000284,The Pianist,2002,Music was his passion. Survival was his masterpiece.,"The true story of pianist Władysław Szpilman's experiences in Warsaw during the Nazi occupation. When the Jews of the city find themselves forced into a ghetto, Szpilman finds work playing in a café; and when his family is deported in 1942, he stays behind, works for a while as a laborer, and eventually goes into hiding in the ruins of the war-torn city.",150,4.37
1000285,The Handmaiden,2016,Never did they expect to get into a controversial relationship...,"In 1930s Korea, a swindler and a young woman pose as a Japanese count and a handmaiden to seduce a Japanese heiress and steal her fortune.",145,4.41
1000286,The Northman,2022,Conquer your fate.,"Prince Amleth is on the verge of becoming a man when his father is brutally murdered by his uncle, who kidnaps the boy's mother. Two decades later, Amleth is now a Viking who's on a mission to save his mother, kill his uncle and avenge his father.",137,3.79
1000287,Licorice Pizza,2021,Things come easy when they matter so much.,"The story of Gary Valentine and Alana Kane growing up, running around and going through the treacherous navigation of first love in the San Fernando Valley, 1973.",133,3.59
1000288,Iron Man 3,2013,Unleash the power behind the armor.,"When Tony Stark's world is torn apart by a formidable terrorist called the Mandarin, he starts an odyssey of rebuilding and retribution.",130,3.01
1000289,Incredibles 2,2018,Back to work.,"Elastigirl springs into action to save the day, while Mr. Incredible faces his greatest challenge yet – taking care of the problems of his three children.",118,3.44
1000290,The Royal Tenenbaums,2001,Family Isn't A Word ... It's A Sentence.,"Royal Tenenbaum and his wife Etheline had three children and then they separated. All three children are extraordinary --- all geniuses. Virtually all memory of the brilliance of the young Tenenbaums was subsequently erased by two decades of betrayal, failure, and disaster. Most of this was generally considered to be their father's fault. ""The Royal Tenenbaums"" is the story of the family's sudden, unexpected reunion one recent winter.",110,4.1
1000291,Suicide Squad,2016,Worst Heroes Ever,"From DC Comics comes the Suicide Squad, an antihero team of incarcerated supervillains who act as deniable assets for the United States government, undertaking high-risk black ops missions in exchange for commuted prison sentences.",122,2.06
1000292,Moana,2016,The ocean is calling.,"In Ancient Polynesia, when a terrible curse incurred by Maui reaches an impetuous Chieftain's daughter's island, she answers the Ocean's call to seek out the demigod to set things right.",107,3.71
1000293,Gladiator,2000,A Hero Will Rise.,"In the year 180, the death of emperor Marcus Aurelius throws the Roman Empire into chaos.  Maximus is one of the Roman army's most capable and trusted generals and a key advisor to the emperor.  As Marcus' devious son Commodus ascends to the throne, Maximus is set to be executed.  He escapes, but is captured by slave traders.  Renamed Spaniard and forced to become a gladiator, Maximus must battle to the death with other men for the amusement of paying audiences.",155,4.11
1000294,Sound of Metal,2019,Music was his world. Then silence revealed a new one.,A drummer begins to lose his hearing and has to come to grips with a future that will be filled with silence.,120,4.19
1000295,Spider-Man 3,2007,The battle within.,"The seemingly invincible Spider-Man goes up against an all-new crop of villains—including the shape-shifting Sandman. While Spider-Man’s superpowers are altered by an alien organism, his alter ego, Peter Parker, deals with nemesis Eddie Brock and also gets caught up in a love triangle.",139,3.04
1000296,TÁR,2022,,"The film, set in the international world of classical music, centers on Lydia Tár, widely considered one of the greatest living composer/conductors and first-ever female chief conductor of a major German orchestra.",158,3.95
1000297,Charlie and the Chocolate Factory,2005,Prepare for a taste of adventure.,"A young boy wins a tour through the most magnificent chocolate factory in the world, led by the world's most unusual candy maker.",115,3.22
