id,name,date,tagline,description,minute,rating
1000448,Wreck-It Ralph,2012,The story of a regular guy just looking for a little wreck-ognition.,"Wreck-It Ralph is the 9-foot-tall, 643-pound villain of an arcade video game named Fix-It Felix Jr., in which the game's titular hero fixes buildings that Ralph destroys. Wanting to prove he can be a good guy and not just a villain, Ralph escapes his game and lands in Hero's Duty, a first-person shooter where he helps the game's hero battle against alien invaders. He later enters Sugar Rush, a kart racing game set on tracks made of candies, cookies and other sweets. There, Ralph meets Vanellope von Schweetz who has learned that her game is faced with a dire threat that could affect the entire arcade, and one that Ralph may have inadvertently started.",101,3.58
1000449,Brave,2012,Change your fate.,"Brave is set in the mystical Scottish Highlands, where Mérida is the princess of a kingdom ruled by King Fergus and Queen Elinor. An unruly daughter and an accomplished archer, Mérida one day defies a sacred custom of the land and inadvertently brings turmoil to the kingdom. In an attempt to set things right, Mérida seeks out an eccentric old Wise Woman and is granted an ill-fated wish. Also figuring into Mérida’s quest — and serving as comic relief — are the kingdom’s three lords: the enormous Lord MacGuffin, the surly Lord Macintosh, and the disagreeable Lord Dingwall.",93,3.35
1000450,Punch-Drunk Love,2002,You can go to places in the world with pudding.,A socially awkward and volatile small business owner meets the love of his life after being threatened by a gang of scammers.,96,3.99
1000451,Rocky,1976,His whole life was a million-to-one shot.,"When world heavyweight boxing champion, Apollo Creed wants to give an unknown fighter a shot at the title as a publicity stunt, his handlers choose palooka Rocky Balboa, an uneducated collector for a Philadelphia loan shark. Rocky teams up with trainer  Mickey Goldmill to make the most of this once in a lifetime break.",120,4.08
1000452,Ghostbusters,1984,They ain't afraid of no ghost.,"After losing their academic posts at a prestigious university, a team of parapsychologists goes into business as proton-pack-toting ""ghostbusters"" who exterminate ghouls, hobgoblins and supernatural pests of all stripes. An ad campaign pays off when a knockout cellist hires the squad to purge her swanky digs of demons that appear to be living in her refrigerator.",107,3.76
1000453,Ocean's Eight,2018,Every con has its pros,"Debbie Ocean, a criminal mastermind, gathers a crew of female thieves to pull off the heist of the century at New York's annual Met Gala.",111,3.29
1000454,Suspiria,2018,Give your soul to the dance.,"A darkness swirls at the center of a world-renowned dance company, one that will engulf the troupe's artistic director, an ambitious young dancer and a grieving psychotherapist. Some will succumb to the nightmare, others will finally wake up.",152,3.74
1000455,Squid Game,2021,"45,6 Billion Won Is Child's Play","Hundreds of cash-strapped players accept a strange invitation to compete in children's games. Inside, a tempting prize awaits — with deadly high stakes.",495,3.73
1000456,American Fiction,2023,,"Thelonious “Monk” Ellison's writing career has stalled because his work isn’t deemed “Black enough.” Monk, a writer and English professor, writes a satirical novel under a pseudonym, aiming to expose the publishing world's hypocrisies. The book’s immediate success forces him to get deeper enmeshed in his assumed identity and challenges his closely-held worldviews.",117,3.72
1000457,12 Years a Slave,2013,The extraordinary true story of Solomon Northup,"In the pre-Civil War United States, Solomon Northup, a free black man from upstate New York, is abducted and sold into slavery. Facing cruelty as well as unexpected kindnesses Solomon struggles not only to stay alive, but to retain his dignity. In the twelfth year of his unforgettable odyssey, Solomon’s chance meeting with a Canadian abolitionist will forever alter his life.",134,4.14
1000458,Terminator 2: Judgment Day,1991,It's nothing personal.,"Nearly 10 years have passed since Sarah Connor was targeted for termination by a cyborg from the future. Now her son, John, the future leader of the resistance, is the target for a newer, more deadly terminator. Once again, the resistance has managed to send a protector back to attempt to save John and his mother Sarah.",137,4.28
1000459,The Terminator,1984,Your future is in his hands.,"In the post-apocalyptic future, reigning tyrannical supercomputers teleport a cyborg assassin known as the ""Terminator"" back to 1984 to kill Sarah Connor, whose unborn son is destined to lead insurgents against 21st century mechanical hegemony. Meanwhile, the human-resistance movement dispatches a lone warrior to safeguard Sarah. Can he stop the virtually indestructible killing machine?",108,3.89
1000460,The Greatest Showman,2017,The Impossible Comes True,"The story of American showman P.T. Barnum, founder of the circus that became the famous traveling Ringling Bros. and Barnum & Bailey Circus.",105,3.37
1000461,Rise of the Planet of the Apes,2011,Evolution Becomes Revolution.,"Scientist Will Rodman is determined to find a cure for Alzheimer's, the disease which has slowly consumed his father. Will feels certain he is close to a breakthrough and tests his latest serum on apes, noticing dramatic increases in intelligence and brain activity in the primate subjects – especially Caesar, his pet chimpanzee.",105,3.63
1000462,"Paris, Texas",1984,A place for dreams. A place for heartbreak. A place to pick up the pieces.,"A man wanders out of the desert not knowing who he is. His brother finds him, and helps to pull his memory back of the life he led before he walked out on his family and disappeared four years earlier.",145,4.4
1000463,Grease,1978,HE WAS IN GREASE,"Australian good girl Sandy and greaser Danny fell in love over the summer. But when they unexpectedly discover they're now in the same high school, will they be able to rekindle their romance despite their eccentric friends?",110,3.49
1000464,The Fall Guy,2024,Fall hard.,"Fresh off an almost career-ending accident, stuntman Colt Seavers has to track down a missing movie star, solve a conspiracy and try to win back the love of his life while still doing his day job.",126,3.5
1000465,Dr. Strangelove or: How I Learned to Stop Worrying and Love the Bomb,1964,The hot-line suspense comedy.,"After the insane General Jack D. Ripper initiates a nuclear strike on the Soviet Union, a war room full of politicians, generals and a Russian diplomat all frantically try to stop the nuclear strike.",95,4.3
1000466,What We Do in the Shadows,2014,Some interviews with some vampires,Vampire housemates try to cope with the complexities of modern life and show a newly turned hipster some of the perks of being undead.,86,4.12
1000467,The Cabin in the Woods,2011,You think you know the story.,"Five college friends spend the weekend at a remote cabin in the woods, where they get more than they bargained for. Together, they must discover the truth behind the cabin in the woods.",95,3.41
1000468,Groundhog Day,1993,"He’s having the worst day of his life … over, and over …","A narcissistic T.V. weatherman, along with his attractive-but-distant producer and mawkish cameraman, is sent to report on Groundhog Day in the small town of Punxsutawney, where he finds himself repeating the same day over and over.",101,3.83
1000469,Crazy Rich Asians,2018,The only thing crazier than love is family,"An American-born Chinese economics professor accompanies her boyfriend to Singapore for his best friend's wedding, only to get thrust into the lives of Asia's rich and famous.",121,3.48
1000470,Back to the Future Part II,1989,"Roads? Where we're going, we don't need roads!","Marty and Doc are at it again in this wacky sequel to the 1985 blockbuster as the time-traveling duo head to 2015 to nip some McFly family woes in the bud. But things go awry thanks to bully Biff Tannen and a pesky sports almanac. In a last-ditch attempt to set things straight, Marty finds himself bound for 1955 and face to face with his teenage parents -- again.",108,3.87
1000471,The Princess Diaries,2001,She rocks. She rules. She reigns.,"A socially awkward but very bright 15-year-old girl being raised by a single mom discovers that she is the princess of a small European country because of the recent death of her long-absent father, who, unknown to her, was the crown prince of Genovia. She must make a choice between continuing the life of a San Francisco teen or stepping up to the throne.",115,3.64
1000472,Pirates of the Caribbean: Dead Man's Chest,2006,Jack is back!,"Captain Jack Sparrow works his way out of a blood debt with the ghostly Davey Jones, he also attempts to avoid eternal damnation.",151,3.62
1000473,The Usual Suspects,1995,Five Criminals. One Line Up. No Coincidence.,"Held in an L.A. interrogation room, Verbal Kint attempts to convince the feds that a mythic crime lord, Keyser Soze, not only exists, but was also responsible for drawing him and his four partners into a multi-million dollar heist that ended with an explosion in San Pedro harbor – leaving few survivors. Verbal lures his interrogators with an incredible story of the crime lord's almost supernatural prowess.",106,4.06
1000474,Mean Girls,2024,Plastic is forever.,"New student Cady Heron is welcomed into the top of the social food chain by the elite group of popular girls called ‘The Plastics,’ ruled by the conniving queen bee Regina George and her minions Gretchen and Karen. However, when Cady makes the major misstep of falling for Regina’s ex-boyfriend Aaron Samuels, she finds herself prey in Regina’s crosshairs. As Cady sets to take down the group’s apex predator with the help of her outcast friends Janis and Damian, she must learn how to stay true to herself while navigating the most cutthroat jungle of all: high school.",113,2.69
1000475,Boogie Nights,1997,"The life of a dreamer, the days of a business, and the nights in between.","Set in 1977, back when sex was safe, pleasure was a business and business was booming, idealistic porn producer Jack Horner aspires to elevate his craft to an art form. Horner discovers Eddie Adams, a hot young talent working as a busboy in a nightclub, and welcomes him into the extended family of movie-makers, misfits and hangers-on that are always around. Adams' rise from nobody to a celebrity adult entertainer is meteoric, and soon the whole world seems to know his porn alter ego, ""Dirk Diggler"". Now, when disco and drugs are in vogue, fashion is in flux and the party never seems to stop, Adams' dreams of turning sex into stardom are about to collide with cold, hard reality.",156,4.21
1000476,Fresh,2022,It’s not for everyone.,"Frustrated by scrolling dating apps only to end up on lame, tedious dates, Noa takes a chance by giving her number to the awkwardly charming Steve after a produce-section meet-cute at the grocery store.",114,3.4
1000477,Life of Pi,2012,Believe The Unbelievable,"The story of an Indian boy named Pi, a zookeeper's son who finds himself in the company of a hyena, zebra, orangutan, and a Bengal tiger after a shipwreck sets them adrift in the Pacific Ocean.",127,3.72
1000478,The Power of the Dog,2021,,"Charismatic rancher Phil Burbank inspires fear and awe in those around him. When his brother brings home a new wife and her son, Phil torments them until he finds himself exposed to the possibility of love.",126,3.67
1000479,Finding Dory,2016,An unforgettable journey she probably won't remember.,Dory is reunited with her friends Nemo and Marlin in the search for answers about her past. What can she remember? Who are her parents? And where did she learn to speak Whale?,97,3.25
1000480,Furiosa: A Mad Max Saga,2024,Fury is born.,"As the world fell, young Furiosa is snatched from the Green Place of Many Mothers and falls into the hands of a great Biker Horde led by the Warlord Dementus. Sweeping through the Wasteland they come across the Citadel presided over by The Immortan Joe. While the two Tyrants war for dominance, Furiosa must survive many trials as she puts together the means to find her way home.",149,3.93
1000481,Now You See Me,2013,4 amazing magicians. 3 impossible heists. 1 billion dollars. This is no illusion.,An FBI agent and an Interpol detective track a team of illusionists who pull off bank heists during their performances and reward their audiences with the money.,116,3.32
1000482,Alice in Wonderland,2010,You're invited to a very important date,"Alice, an unpretentious and individual 19-year-old, is betrothed to a dunce of an English nobleman. At her engagement party, she escapes the crowd to consider whether to go through with the marriage and falls down a hole in the garden after spotting an unusual rabbit. Arriving in a strange and surreal place called 'Underland,' she finds herself in a world that resembles the nightmares she had as a child, filled with talking animals, villainous queens and knights, and frumious bandersnatches. Alice realizes that she is there for a reason – to conquer the horrific Jabberwocky and restore the rightful queen to her throne.",108,3.08
1000483,Almost Famous,2000,Experience it. Enjoy it. Just don't fall for it.,"In 1973, 15-year-old William Miller's unabashed love of music and aspiration to become a rock journalist lands him an assignment from Rolling Stone magazine to interview and tour with the up-and-coming band, Stillwater.",124,4.04
1000484,Elf,2003,"This holiday, discover your inner elf.","When young Buddy falls into Santa's gift sack on Christmas Eve, he's transported back to the North Pole and raised as a toy-making elf by Santa's helpers. But as he grows into adulthood, he can't shake the nagging feeling that he doesn't belong. Buddy vows to visit Manhattan and find his real dad, a workaholic publisher.",97,3.43
1000485,Magnolia,1999,"Things fall down. People look up. And when it rains, it pours.","An epic mosaic of many interrelated characters in search of happiness, forgiveness, and meaning in the San Fernando Valley.",189,4.22
1000486,The Invisible Man,2020,What You Can't See Can Hurt You,"When Cecilia's abusive ex takes his own life and leaves her his fortune, she suspects his death was a hoax. As a series of coincidences turn lethal, Cecilia works to prove that she is being hunted by someone nobody can see.",124,3.43
1000487,Perfect Days,2023,,Hirayama seems utterly content with his simple life as a cleaner of toilets in Tokyo. Outside of his very structured everyday routine he enjoys his passion for music and for books. And he loves trees and takes photos of them. A series of unexpected encounters gradually reveal more of his past.,124,4.26
1000488,Hacksaw Ridge,2016,One of the greatest heroes in American history never fired a bullet.,"WWII American Army Medic Desmond T. Doss, who served during the Battle of Okinawa, refuses to kill people and becomes the first Conscientious Objector in American history to receive the Congressional Medal of Honor.",139,3.9
1000489,The Blair Witch Project,1999,THE SCARIEST MOVIE OF ALL TIME IS A TRUE STORy.,"In October of 1994 three student filmmakers disappeared in the woods near Burkittsville, Maryland, while shooting a documentary. A year later their footage was found.",81,3.31
1000490,Casino Royale,2006,Everyone has a past. Every legend has a beginning.,"Le Chiffre, a banker to the world's terrorists, is scheduled to participate in a high-stakes poker game in Montenegro, where he intends to use his winnings to establish his financial grip on the terrorist market. M sends Bond—on his maiden mission as a 00 Agent—to attend this game and prevent Le Chiffre from winning. With the help of Vesper Lynd and Felix Leiter, Bond enters the most important poker game in his already dangerous career.",144,4.01
1000491,Heathers,1989,"Best friends, social trends, and occasional murder.","A girl who halfheartedly tries to be part of the ""in crowd"" of her school meets a rebel who teaches her a more devious way to play social politics: by killing the popular kids.",103,3.76
1000492,It's a Wonderful Life,1946,It's a wonderful laugh! It's a wonderful love!,"A holiday favourite for generations...  George Bailey has spent his entire life giving to the people of Bedford Falls.  All that prevents rich skinflint Mr. Potter from taking over the entire town is George's modest building and loan company.  But on Christmas Eve the business's $8,000 is lost and George's troubles begin.",130,4.39
1000493,Monkey Man,2024,One small ember can burn down everything.,"Kid is an anonymous young man who ekes out a meager living in an underground fight club where, night after night, wearing a gorilla mask, he is beaten bloody by more popular fighters for cash. After years of suppressed rage, Kid discovers a way to infiltrate the enclave of the city’s sinister elite. As his childhood trauma boils over, his mysteriously scarred hands unleash an explosive campaign of retribution to settle the score with the men who took everything from him.",121,3.76
1000494,Aladdin,1992,Wish granted!,"Princess Jasmine grows tired of being forced to remain in the palace, so she sneaks out into the marketplace, in disguise, where she meets street-urchin Aladdin.  The couple falls in love, although Jasmine may only marry a prince.  After being thrown in jail, Aladdin becomes embroiled in a plot to find a mysterious lamp, with which the evil Jafar hopes to rule the land.",95,3.88
1000495,A Nightmare on Elm Street,1984,"If Nancy Doesn't Wake Up Screaming, She Won't Wake Up At All!","Teenagers in a small town are dropping like flies, apparently in the grip of mass hysteria causing their suicides. A cop's daughter, Nancy Thompson, traces the cause to child molester Fred Krueger, who was burned alive by angry parents many years before. Krueger has now come back in the dreams of his killers' children, claiming their lives as his revenge. Nancy and her boyfriend, Glen, must devise a plan to lure the monster out of the realm of nightmares and into the real world...",91,3.73
1000496,Aliens,1986,This Time It's War,"When Ripley's lifepod is found by a salvage crew over 50 years later, she finds that terra-formers are on the very planet they found the alien species. When the company sends a family of colonists out to investigate her story—all contact is lost with the planet and colonists. They enlist Ripley and the colonial marines to return and search for answers.",137,4.15
1000497,Rosemary's Baby,1968,Pray for Rosemary's Baby,A young couple moves into an infamous New York apartment building to start a family. Things become frightening as Rosemary begins to suspect her unborn baby isn’t safe around their strange neighbors.,138,4.21
1000498,Indiana Jones and the Last Crusade,1989,"The man with the hat is back. And this time, he's bringing his Dad.","When Dr. Henry Jones Sr. suddenly goes missing while pursuing the Holy Grail, eminent archaeologist Indiana must team up with Marcus Brody, Sallah and Elsa Schneider to follow in his father's footsteps and stop the Nazis from recovering the power of eternal life.",127,4.09
1000499,The Hobbit: An Unexpected Journey,2012,From the smallest beginnings come the greatest legends.,"Bilbo Baggins, a hobbit enjoying his quiet life, is swept into an epic quest by Gandalf the Grey and thirteen dwarves who seek to reclaim their mountain home from Smaug, the dragon.",169,3.46
1000500,Mr. & Mrs. Smith,2005,Smart and sexy.,"After five (or six) years of vanilla-wedded bliss, ordinary suburbanites John and Jane Smith are stuck in a huge rut. Unbeknownst to each other, they are both coolly lethal, highly-paid assassins working for rival organisations. When they discover they're each other's next target, their secret lives collide in a spicy, explosive mix of wicked comedy, pent-up passion, nonstop action and high-tech weaponry.",119,3.19
1000501,Monsters University,2013,School never looked this scary.,A look at the relationship between Mike and Sulley during their days at Monsters University — when they weren't necessarily the best of friends.,104,3.38
1000502,Cocaine Bear,2023,Get in line.,"An oddball group of cops, criminals, tourists and teens converge in a Georgia forest where a 500-pound black bear goes on a murderous rampage after unintentionally ingesting cocaine.",95,2.71
1000503,The Maze Runner,2014,Remember. Survive. Run.,"Set in a post-apocalyptic world, young Thomas is deposited in a community of boys after his memory is erased, soon learning they're all trapped in a maze that will require him to join forces with fellow “runners” for a shot at escape.",113,3.32
1000504,But I'm a Cheerleader,1999,A Comedy Of Sexual Disorientation.,"Megan is an all-American girl. A cheerleader. She has a boyfriend. But Megan doesn't like kissing her boyfriend very much. And she's pretty touchy with her cheerleader friends. Her conservative parents worry that she must be a lesbian and send her off to ""sexual redirection"" school, where she must, with other lesbians and gays learn how to be straight.",85,3.99
1000505,X-Men: Days of Future Past,2014,"To save the future, they must alter the past",The ultimate X-Men ensemble fights a war for the survival of the species across two time periods as they join forces with their younger selves in an epic battle that must change the past – to save our future.,132,3.63
1000506,Megamind,2010,His brain is off the chain.,"Bumbling supervillain Megamind finally defeats his nemesis, the superhero Metro Man. But without a hero, he loses all purpose and must find new meaning to his life.",96,3.69
1000507,Sorry to Bother You,2018,Destiny Is Calling,"In an alternate present-day version of Oakland, black telemarketer Cassius Green discovers a magical key to professional success – which propels him into a macabre universe.",112,3.73
1000508,Batman v Superman: Dawn of Justice,2016,Justice or revenge,"Fearing the actions of a god-like Super Hero left unchecked, Gotham City’s own formidable, forceful vigilante takes on Metropolis’s most revered, modern-day savior, while the world wrestles with what sort of hero it really needs. And with Batman and Superman at war with one another, a new threat quickly arises, putting mankind in greater danger than it’s ever known before.",152,2.41
1000509,Roma,2018,There are periods in history that scar societies and moments in life that transform us as individuals.,"In 1970s Mexico City, two domestic workers help a mother of four while her husband is away for an extended period of time.",135,4.1
1000510,Solo: A Star Wars Story,2018,Never tell him the odds.,"Through a series of daring escapades deep within a dark and dangerous criminal underworld, Han Solo meets his mighty future copilot Chewbacca and encounters the notorious gambler Lando Calrissian.",135,2.9
1000511,The Idea of You,2024,When the last thing you expect becomes the only thing you want.,"40-year-old single mom Solène begins an unexpected romance with 24-year-old Hayes Campbell, the lead singer of August Moon, the hottest boy band on the planet.",116,2.55
1000512,American History X,1998,Some Legacies Must End.,"Derek Vineyard is paroled after serving 3 years in prison for killing two thugs who tried to break into/steal his truck. Through his brother, Danny Vineyard's narration, we learn that before going to prison, Derek was a skinhead and the leader of a violent white supremacist gang that committed acts of racial crime throughout L.A. and his actions greatly influenced Danny. Reformed and fresh out of prison, Derek severs contact with the gang and becomes determined to keep Danny from going down the same violent path as he did.",119,4.13
1000513,Dawn of the Planet of the Apes,2014,One last chance for peace.,"A group of scientists in San Francisco struggle to stay alive in the aftermath of a plague that is wiping out humanity, while Caesar tries to maintain dominance over his community of intelligent apes.",130,3.8
1000514,Spencer,2021,Every fairy tale ends.,"Covers a critical weekend in the early ‘90s, when Princess Diana decided her marriage to Prince Charles wasn’t working, and that she needed to veer from a path that put her in line to one day be queen.",117,3.66
1000515,WandaVision,2021,Experience a new vision of reality.,Wanda Maximoff and Vision—two super-powered beings living idealized suburban lives—begin to suspect that everything is not as it seems.,350,3.75
1000516,Napoleon,2023,He came from nothing. He conquered everything.,"An epic that details the checkered rise and fall of French Emperor Napoleon Bonaparte and his relentless journey to power through the prism of his addictive, volatile relationship with his wife, Josephine.",158,2.96
1000517,Despicable Me,2010,Superbad. Superdad.,"Villainous Gru lives up to his reputation as a despicable, deplorable and downright unlikable guy when he hatches a plan to steal the moon from the sky. But he has a tough time staying on task after three orphans land in his care.",95,3.53
1000518,Raging Bull,1980,,"When Jake LaMotta steps into a boxing ring and obliterates his opponent, he's a prizefighter. But when he treats his family and friends the same way, he's a ticking time bomb, ready to go off at any moment. Though LaMotta wants his family's love, something always seems to come between them. Perhaps it's his violent bouts of paranoia and jealousy. This kind of rage helped make him a champ, but in real life, he winds up in the ring alone.",129,4.25
